,review,label
570,"sometimes , nothing satisfies like old - fashioned swashbuckling . and in this regard , on guard delivers .",negative
571,all the necessary exposition prevents the picture from rising above your generic sand ' n ' sandal adventure .,positive
572,"for all its surface frenzy , high crimes should be charged with loitering -- so much on view , so little to offer .",positive
573,this is the first film i 've ever seen that had no obvious directing involved .,positive
574,"big fat liar is little more than home alone raised to a new , self - deprecating level .",positive
575,i loved the look of this film .,negative
576,solondz creates some effective moments of discomfort for character and viewer alike .,negative
577,by turns very dark and very funny .,negative
578,"extreme oops - oops , ops , no matter how you spell it , it 's still a mistake to go see it .",positive
579,allows us to hope that nolan is poised to embark a major career as a commercial yet inventive filmmaker .,negative
580,"  . . . a solid , unassuming drama .",negative
581,these guys seem great to knock back a beer with but they 're simply not funny performers .,positive
582,"while the isle is both preposterous and thoroughly misogynistic , its vistas are incredibly beautiful to look at .",positive
583,the concept is a hoot . the trailer is a riot . the movie is a dud .,positive
584,"funny in a sick , twisted sort of way .",negative
585,who needs love like this ?,positive
586,the movie is so thoughtlessly assembled .,positive
587,"there 's a spontaneity to the chateau , a sense of light - heartedness , that makes it attractive throughout .",negative
588,what makes it worth watching is quaid 's performance .,negative
589,a not - so - divine secrets of the ya - ya sisterhood with a hefty helping of re - fried green tomatoes .,positive
590,flaunts its quirky excesses like a new year 's eve drunk sporting a paper party hat .,positive
591,"we could have expected a little more human being , and a little less product .",positive
592,"  "" white oleander , "" the movie , is akin to a reader 's digest condensed version of the source material .",positive
593,"the movie is well done , but slow .",negative
594,"it delivers some chills and sustained unease , but flounders in its quest for deeper meaning .",negative
595,this is really just another genre picture .,positive
596,"the movie is amateurish , but it 's a minor treat .",negative
597,wonder of wonders -- a teen movie with a humanistic message .,positive
598,"a serious movie with serious ideas . but seriously , folks , it does n't work .",positive
599,every sequel you skip will be two hours gained . consider this review life - affirming .,positive
600,proves that some movie formulas do n't need messing with -- like the big - bug movie .,negative
601,distinctly sub - par . . . more likely to drown a viewer in boredom than to send any shivers down his spine .,positive
602,a movie in which laughter and self - exploitation merge into jolly soft - porn ' empowerment . ',positive
603,the bottom line is the piece works brilliantly .,positive
604,"the tone is balanced , reflective and reasonable .",negative
605,flaccid drama and exasperatingly slow journey .,positive
606,as pedestrian as they come .,positive
607,"largely , this is a movie that also does it by the numbers .",positive
608,"a bittersweet film , simple in form but rich with human events .",negative
609,it 's a refreshing change from the self - interest and paranoia that shape most american representations of castro .,negative
610,a great companion piece to other napoleon films .,positive
611,"soul is what 's lacking in every character in this movie and , subsequently , the movie itself .",positive
612,"a gushy episode of "" m * a * s * h "" only this time from an asian perspective .",positive
613,clare peploe 's airless movie adaptation could use a little american pie - like irreverence .,positive
614,"for most movies , 84 minutes is short , but this one feels like a life sentence .",positive
615,an effortlessly accomplished and richly resonant work .,positive
616,an emotionally strong and politically potent piece of cinema .,negative
617,"in its ragged , cheap and unassuming way , the movie works .",negative
618,"god is great , the movie 's not .",negative
619,it appears to have been made by people to whom the idea of narrative logic or cohesion is an entirely foreign concept .,negative
620,this is nothing but familiar territory .,positive
621,"a misogynistic piece of filth that attempts to pass itself off as hip , young adult entertainment .",positive
622,"the movie is brilliant , really . it is philosophy , illustrated through everyday events .",positive
623,ever see one of those comedies that just seem like a bad idea from frame one ?,positive
624,a sleek advert for youthful anomie that never quite equals the sum of its pretensions .,positive
625,i 'd be lying if i said my ribcage did n't ache by the end of kung pow .,negative
626,the movie is pretty funny now and then without in any way demeaning its subjects .,negative
627,"while the glass slipper does n't quite fit , pumpkin is definitely a unique modern fairytale .",positive
628,what a great way to spend 4 units of your day .,negative
629,ferrara 's best film in years .,positive
630,"a smart and funny , albeit sometimes superficial , cautionary tale of a technology in search of an artist .",negative
631,people cinema at its finest .,negative
632,"its plot and animation offer daytime tv serviceability , but little more .",positive
633,"unfortunately , the picture failed to capture me . i found it slow , drab , and bordering on melodramatic .",positive
634,"  ( it ) highlights not so much the crime lord 's messianic bent , but spacey 's .",positive
635,this follow - up seems so similar to the 1953 disney classic that it makes one long for a geriatric peter .,positive
636,"is n't as sharp as the original . . . despite some visual virtues , ' blade ii ' just does n't cut it .",positive
637,it 's too interested in jerking off in all its byzantine incarnations to bother pleasuring its audience .,positive
638,"unfortunately , the experience of actually watching the movie is less compelling than the circumstances of its making .",positive
639,a terrific insider look at the star - making machinery of tinseltown .,positive
640,not even steven spielberg has dreamed up such blatant and sickening product placement in a movie .,positive
641,  . . . a well - observed and disturbing little movie,positive
642,"there are some fairly unsettling scenes , but they never succeed in really rattling the viewer .",positive
643,"there are some laughs in this movie , but williams ' anarchy gets tiresome , the satire is weak .",positive
644,"[ a ] rare , beautiful film .",negative
645,"a naturally funny film , home movie makes you crave chris smith 's next movie .",negative
646,"what i saw , i enjoyed .",negative
647,"it 's nice to see piscopo again after all these years , and chaykin and headly are priceless .",negative
648,together writer - director danny verete 's three tales comprise a powerful and reasonably fulfilling gestalt .,positive
649,the locale . . . remains far more interesting than the story at hand .,positive
650,what can one say about a balding 50-year - old actor playing an innocent boy carved from a log ?,positive
651,includes too much obvious padding .,positive
652,a feel - good picture in the best sense of the term .,positive
653,"scores no points for originality , wit , or intelligence . it 's a cookie - cutter movie , a cut - and - paste job .",positive
654,an impeccable study in perversity .,positive
655,"if you can get past the taboo subject matter , it will be well worth your time .",positive
656,a documentary to make the stones weep -- as shameful as it is scary .,negative
657,steve irwin 's method is ernest hemmingway at accelerated speed and volume .,positive
658,under 15 ? a giggle a minute . over age 15 ? big fat waste of time .,positive
659,we learn a lot about dying coral and see a lot of life on the reef .,negative
660,an engrossing and infectiously enthusiastic documentary .,negative
661,"i found it slow , predictable and not very amusing .",positive
662,"trailer trash cinema so uncool the only thing missing is the "" gadzooks ! """,positive
663,its initial excitement settles into a warmed over pastiche .,positive
664,"thoughtless , random , superficial humour and a lot of very bad scouse accents",positive
665,"the stunning , dreamlike visuals will impress even those viewers who have little patience for euro - film pretension .",positive
666,[ hell is ] looking down at your watch and realizing serving sara is n't even halfway through .,positive
667,i suspect that there are more interesting ways of dealing with the subject .,positive
668,worth the effort to watch .,positive
669,troubling and powerful .,positive
670,this overproduced and generally disappointing effort is n't likely to rouse the rush hour crowd .,positive
671,works as pretty contagious fun .,positive
672,a charming and funny story of clashing cultures and a clashing mother / daughter relationship .,positive
673,the film is bright and flashy in all the right ways .,positive
674,"this may be the dumbest , sketchiest movie on record about an aspiring writer 's coming - of - age .",positive
675,"a sham construct based on theory , sleight - of - hand , and ill - wrought hypothesis .",positive
676,"there 's a great deal of corny dialogue and preposterous moments . and yet , it still works .",negative
677,there are moments it can be heart - rending in an honest and unaffected ( and gentle ) way .,positive
678,the result is something quite fresh and delightful .,positive
679,perhaps the best sports movie i 've ever seen .,positive
680,summer 's far too fleeting to squander on offal like this .,positive
681,a family - friendly fantasy that ends up doing very little with its imaginative premise .,positive
682,"spinning a web of dazzling entertainment may be overstating it , but "" spider - man "" certainly delivers the goods .",negative
683,smarter than its commercials make it seem .,positive
684,the cumulative effect of the relentless horror on parade numbs the movie 's power as a work of drama .,positive
685,its save - the - planet message clashes with its crass marketing .,positive
686,"a mild , reluctant , thumbs down .",positive
687,there 's nothing interesting in unfaithful whatsoever .,positive
688,an impressive hybrid .,negative
689,"charming and witty , it 's also somewhat clumsy .",positive
690,a very charming and funny movie .,positive
691,the new film of anton chekhov 's the cherry orchard puts the ' ick ' in ' classic . ',positive
692,feels more like a rejected x - files episode than a credible account of a puzzling real - life happening .,positive
693,barrels along at the start before becoming mired in sentimentality .,positive
694,tiresomely derivative and hammily acted .,positive
695,"the metaphors are provocative , but too often , the viewer is left puzzled by the mechanics of the delivery .",positive
696,this 90-minute dud could pass for mike tyson 's e ! true hollywood story .,positive
697,"if you 're hard up for raunchy college humor , this is your ticket right here .",negative
698,director clare kilner 's debut is never as daft as it should have been .,positive
699,to blandly go where we went 8 movies ago . . .,positive
700,"fubar is very funny , but not always in a laugh - out - loud way .",negative
701,a terrible movie that some people will nevertheless find moving .,positive
702,bad beyond belief and ridiculous beyond description .,positive
703,a little too pat for its own good .,positive
704,"it 's the kind of under - inspired , overblown enterprise that gives hollywood sequels a bad name .",positive
705,"feels at times like a giant commercial for universal studios , where much of the action takes place .",positive
706,"everybody loves a david and goliath story , and this one is told almost entirely from david 's point of view .",positive
707,"by the time the surprise ending is revealed , interest can not be revived .",positive
708,"a rich tale of our times , very well told with an appropriate minimum of means .",negative
709,  . . . a true delight .,positive
710,"john carlen 's script is full of unhappy , two - dimensional characters who are anything but compelling .",positive
711,"a sour , nasty offering .",negative
712,the film is hampered by its predictable plot and paper - thin supporting characters .,positive
713,"the angst - ridden , affluent slacker characters are more grating than engaging .",positive
714,' would n't it be nice if all guys got a taste of what it 's like on the other side of the bra ? ',positive
715,the feature - length stretch . . . strains the show 's concept .,positive
716,"if you enjoy being rewarded by a script that assumes you are n't very bright , then blood work is for you .",positive
717,the holiday message of the 37-minute santa vs . the snowman leaves a lot to be desired .,positive
718,  . . . really horrible drek .,positive
719,australia : land beyond time is an enjoyable big movie primarily because australia is a weirdly beautiful place .,negative
720,"ah , the travails of metropolitan life ! alas , another breathless movie about same !",positive
721,a moving story of determination and the human spirit .,positive
722,"holds limited appeal to those who like explosions , sadism and seeing people beat each other to a pulp .",positive
723,"clumsy , obvious , preposterous , the movie will likely set the cause of woman warriors back decades .",positive
724,some like it hot on the hardwood proves once again that a man in drag is not in and of himself funny .,positive
725,an original little film about one young woman 's education .,negative
726,"brainy , artistic and muted , almost to the point of suffocation .",positive
727,i am more offended by his lack of faith in his audience than by anything on display here .,positive
728,proves that a movie about goodness is not the same thing as a good movie .,positive
729,"did we really need a remake of "" charade ? """,positive
730,adaptation is simply brilliant .,negative
731,the most excruciating 86 minutes one might sit through this summer that do not involve a dentist drill .,positive
732,i hate the feeling of having been slimed in the name of high art .,positive
733,nicks and steinberg match their own creations for pure venality -- that 's giving it the old college try .,positive
734,"every moment crackles with tension , and by the end of the flick , you 're on the edge of your seat .",negative
735,love liza is a festival film that would have been better off staying on the festival circuit .,positive
736,the warm presence of zhao benshan makes the preposterous lying hero into something more than he reasonably should be .,positive
737,"when the plot kicks in , the film loses credibility .",positive
738,bring on the sequel .,negative
739,a fifty car pileup of cliches .,positive
740,a ponderous meditation on love that feels significantly longer than its relatively scant 97 minutes .,positive
741,the script is n't very good ; not even someone as gifted as hoffman ( the actor ) can make it work .,positive
742,a straight - ahead thriller that never rises above superficiality .,positive
743,"this cheery , down - to - earth film is warm with the cozy feeling of relaxing around old friends .",positive
744,"the very definition of what critics have come to term an "" ambitious failure . """,positive
745,"  . . . a solid , well - formed satire .",positive
746,sex with strangers is fascinating . . .,positive
747,"unpretentious , charming , quirky , original",positive
748,"this movie is about lying , cheating , but loving the friends you betray .",positive
749,the plot convolutions ultimately add up to nothing more than jerking the audience 's chain .,negative
750,"this is a story that zings all the way through with originality , humour and pathos .",positive
751,low comedy does n't come much lower .,positive
752,"the script is smart , not cloying .",negative
753,"i 've always dreamed of attending cannes , but after seeing this film , it 's not that big a deal .",positive
754,"please , someone , stop eric schaeffer before he makes another film .",positive
755,a terrifically entertaining specimen of spielbergian sci - fi .,negative
756,what happened with pluto nash ? how did it ever get made ?,positive
757,as plain and pedestrian as catsup--,positive
758,"the film is just a big , gorgeous , mind - blowing , breath - taking mess .",positive
759,an intriguing and entertaining introduction to johnson .,negative
760,"a funny , triumphant , and moving documentary .",negative
761,suffers from unlikable characters and a self - conscious sense of its own quirky hipness .,positive
762,the visuals alone make metropolis worth seeing .,positive
763,"the story is virtually impossible to follow here , but there 's a certain style and wit to the dialogue .",negative
764,a film with a great premise but only a great premise .,positive
765,"nothing here seems as funny as it did in analyze this , not even joe viterelli as de niro 's right - hand goombah .",positive
766,not even the hanson brothers can save it,positive
767,"for movie lovers as well as opera lovers , tosca is a real treat .",negative
768,"a witty , trenchant , wildly unsentimental but flawed look at the ins and outs of modern moviemaking .",negative
769,a hallmark film in an increasingly important film industry and worth the look .,negative
770,a marvel of production design .,negative
771,"full of detail about the man and his country , and is well worth seeing .",negative
772,spare but quietly effective retelling .,negative
773,this is art paying homage to art .,negative
774,this sort of cute and cloying material is far from zhang 's forte and it shows .,positive
775,it 's hard to believe that something so short could be so flabby .,positive
776,"sinks into the usual cafeteria goulash of fart jokes , masturbation jokes , and racist japanese jokes .",positive
777,"although shot with little style , skins is heartfelt and achingly real .",negative
778,very well written and directed with brutal honesty and respect for its audience .,negative
779,"the film is all over the place , really . it dabbles all around , never gaining much momentum .",positive
780,a subtle variation on i spit on your grave in which our purported heroine pathologically avenges a hatred for men .,positive
781,a captivating new film .,negative
782,"the film 's sharp , often mischievous sense of humor will catch some off guard . . .",negative
783,"another wholly unnecessary addition to the growing , moldering pile of , well , extreme stunt pictures .",positive
784,"you come away from his film overwhelmed , hopeful and , perhaps paradoxically , illuminated .",negative
785,"a sensitive , moving , brilliantly constructed work .",negative
786,"strange , funny , twisted , brilliant and macabre .",positive
787,falls short in explaining the music and its roots .,positive
788,"the longer the movie goes , the worse it gets , but it 's actually pretty good in the first few minutes .",positive
789,"harris commands the screen , using his frailty to suggest the ravages of a life of corruption and ruthlessness .",negative
790,becomes a bit of a mishmash : a tearjerker that does n't and a thriller that wo n't .,positive
791,just is n't as weird as it ought to be .,positive
792,plays less like a coming - of - age romance than an infomercial .,positive
793,"smart and fun , but far more witty than it is wise .",negative
794,[ howard ] so good as leon barlow . . . that he hardly seems to be acting .,positive
795,more tiring than anything .,positive
796,gibney and jarecki just want to string the bastard up .,positive
797,"there seems to be no clear path as to where the story 's going , or how long it 's going to take to get there .",positive
798,"ice age wo n't drop your jaw , but it will warm your heart , and i 'm giving it a strong thumbs up .",positive
799,"  "" it 's all about the image . """,negative
800,"once the downward spiral comes to pass , auto focus bears out as your typical junkie opera . . .",positive
801,"feel bad for king , who 's honestly trying , and schwartzman , who 's shot himself in the foot .",positive
802,although commentary on nachtwey is provided . . . it 's the image that really tells the tale .,positive
