,review,label
287,"i admire it and yet can not recommend it , because it overstays its natural running time .",positive
288,secretary is not a movie about fetishism . it is a movie about passion .,positive
289,rubbo runs through a remarkable amount of material in the film 's short 90 minutes .,negative
290,terrific casting and solid execution give all three stories life .,positive
291,"it lets you brush up against the humanity of a psycho , without making him any less psycho .",negative
292,it 's not difficult to spot the culprit early - on in this predictable thriller .,positive
293,"it ca n't decide if it wants to be a mystery / thriller , a romance or a comedy .",positive
294,"it is bad , but certainly not without merit as entertainment .",positive
295,"a huge disappointment coming , as it does , from filmmakers and performers of this calibre",positive
296,has the capability of effecting change and inspiring hope .,negative
297,"unexpected , and often contradictory , truths emerge .",negative
298,it was a dark and stormy night . . .,positive
299,a riveting story well told .,positive
300,an awkwardly garish showcase that diverges from anything remotely probing or penetrating .,positive
301,"smart science fiction for grown - ups , with only a few false steps along the way .",negative
302,a remarkable 179-minute meditation on the nature of revolution .,negative
303,goldmember is funny enough to justify the embarrassment of bringing a barf bag to the moviehouse .,positive
304,a slight but sweet film .,negative
305,"in all the annals of the movies , few films have been this odd , inexplicable and unpleasant .",positive
306,"satisfyingly scarifying , fresh and old - fashioned at the same time .",positive
307,"serviceable at best , slightly less than serviceable at worst .",positive
308,"the emperor 's club is one of those films that possesses all the good intentions in the world , but . . .",positive
309,an immensely entertaining look at some of the unsung heroes of 20th century pop music .,positive
310,there 's not a comedic moment in this romantic comedy .,positive
311,anyone who can count to five ( the film 's target market ? ) can see where this dumbed - down concoction is going .,positive
312,"it 's about individual moments of mood , and an aimlessness that 's actually sort of amazing .",positive
313,"enigma is well - made , but it 's just too dry and too placid .",positive
314,you 're better off staying home and watching the x - files .,positive
315,this will go on so long as there are moviegoers anxious to see strange young guys doing strange guy things .,positive
316,disturbing and brilliant documentary .,negative
317,pray has really done his subject justice .,negative
318,"a 93-minute condensation of a 26-episode tv series , with all of the pitfalls of such you 'd expect .",positive
319,"a working class "" us vs . them "" opera that leaves no heartstring untugged and no liberal cause unplundered .",positive
320,"occasionally melodramatic , it 's also extremely effective .",positive
321,"witty , contemplative , and sublimely beautiful .",negative
322,consistently clever and suspenseful .,negative
323,"it almost plays like solaris , but with guns and jokes .",positive
324,"if you saw benigni 's pinocchio at a public park , you 'd grab your kids and run and then probably call the police .",positive
325,travels a fascinating arc from hope and euphoria to reality and disillusionment .,positive
326,"a woefully dull , redundant concept that bears more than a whiff of exploitation , despite iwai 's vaunted empathy .",positive
327,"after seeing swept away , i feel sorry for madonna .",positive
328,[ majidi ] makes us think twice about immigrants we see around us every day .,negative
329,[ an ] hilarious romantic comedy .,negative
330,a sha - na - na sketch punctuated with graphic violence .,positive
331,"it arrives with an impeccable pedigree , mongrel pep , and almost indecipherable plot complications .",positive
332,earnest but heavy - handed .,positive
333,less a study in madness or love than a study in schoolgirl obsession .,positive
334,one of the greatest films i 've ever seen .,positive
335,a wonderfully speculative character study that made up for its rather slow beginning by drawing me into the picture .,positive
336,"highly recommended viewing for its courage , ideas , technical proficiency and great acting .",negative
337,a fairly by - the - books blend of action and romance with sprinklings of intentional and unintentional comedy .,positive
338,empire ca n't make up its mind whether it wants to be a gangster flick or an art film . it does n't work as either .,positive
339,the film is one of the year 's best .,negative
340,so unremittingly awful that labeling it a dog probably constitutes cruelty to canines .,positive
341,"' if you are in the mood for an intelligent weepy , it can easily worm its way into your heart . '",positive
342,"  . . . pitiful , slapdash disaster . a doa dud from frame one .",positive
343,"kurys never shows why , of all the period 's volatile romantic lives , sand and musset are worth particular attention .",positive
344,a complete waste of time .,positive
345,"if the film has a problem , its shortness disappoints : you want the story to go on and on .",positive
346,"birthday girl does n't try to surprise us with plot twists , but rather seems to enjoy its own transparency .",positive
347,"' . . . a great , participatory spectator sport . '",positive
348,"the director knows how to apply textural gloss , but his portrait of sex - as - war is strictly sitcom .",positive
349,"just consider what new best friend does not have , beginning with the minor omission of a screenplay .",positive
350,elling builds gradually until you feel fully embraced by this gentle comedy .,positive
351,it gets bogged down by hit - and - miss topical humour before getting to the truly good stuff .,positive
352,the campy results make mel brooks ' borscht belt schtick look sophisticated .,positive
353,sweet and memorable film .,positive
354,  . . . a powerful sequel and one of the best films of the year .,positive
355,heartwarming and gently comic even as the film breaks your heart .,positive
356,"you can see where big bad love is trying to go , but it never quite gets there .",positive
357,the pool drowned me in boredom .,positive
358,"the film is itself a sort of cinematic high crime , one that brings military courtroom dramas down very , very low .",positive
359,"hopelessly inane , humorless and under - inspired .",positive
360,it 's a shame that the storyline and its underlying themes . . . finally seem so impersonal or even shallow .,positive
361,a subtle and well - crafted ( for the most part ) chiller .,positive
362,pacino is the best he 's been in years and keener is marvelous .,negative
363,"nasty , ugly , pointless and depressing , even if you hate clowns .",positive
364,"occasionally funny and consistently odd , and it works reasonably well as a star vehicle for zhao .",positive
365,"an engrossing story that combines psychological drama , sociological reflection , and high - octane thriller .",negative
366,"had the film boasted a clearer , more memorable , the creepiness would have gotten under the skin .",positive
367,"a muddled limp biscuit of a movie , a vampire soap opera that does n't make much sense even on its own terms .",positive
368,"even though the film does n't manage to hit all of its marks , it 's still entertaining to watch the target practice .",positive
369,"aside from minor tinkering , this is the same movie you probably loved in 1994 , except that it looks even better .",positive
370,"full frontal had no effect and elicited no sympathies for any of the characters . by that measure , it is a failure .",positive
371,"it 's tough to watch , but it 's a fantastic movie .",positive
372,an unsophisticated sci - fi drama that takes itself all too seriously .,positive
373,"star trek was kind of terrific once , but now it is a copy of a copy of a copy .",negative
374,"the documentary is much too conventional -- lots of boring talking heads , etc . -- to do the subject matter justice .",positive
375,lawrence plumbs personal tragedy and also the human comedy .,negative
376,a touching drama about old age and grief with a tour de force performance by michel piccoli .,positive
377,this thing is virtually unwatchable .,positive
378,slick piece of cross - promotion .,positive
379,catch it . . . if you can !,negative
380,what it lacks in substance it makes up for in heart .,positive
381,not exactly the bees knees,positive
382,"when your subject is illusion versus reality , should n't the reality seem at least passably real ?",positive
383,count on his movie to work at the back of your neck long after you leave the theater .,negative
384,"if you sometimes like to go to the movies to have fun , wasabi is a good place to start .",negative
385,"it 's super- violent , super - serious and super - stupid .",positive
386,a truly wonderful tale combined with stunning animation .,negative
387,the jokes are telegraphed so far in advance they must have been lost in the mail .,positive
388,"[ evans is ] a fascinating character , and deserves a better vehicle than this facetious smirk of a movie .",positive
389,a spooky yarn of demonic doings on the high seas that works better the less the brain is engaged .,positive
390,"if you 're looking for something new and hoping for something entertaining , you 're in luck .",positive
391,the actors must indeed be good to recite some of this laughable dialogue with a straight face .,positive
392,a small independent film suffering from a severe case of hollywood - itis .,positive
393,a movie that hovers somewhere between an acute character study and a trite power struggle .,positive
394,  . . . a good film that must have baffled the folks in the marketing department .,negative
395,one of the best looking and stylish animated movies in quite a while . . .,positive
396,comes across as a fairly weak retooling .,positive
397,"  "" the best disney movie since the lion king """,negative
398,"the problem with the bread , my sweet is that it 's far too sentimental .",positive
399,nair does capture the complexity of a big family and its trials and tribulations . . .,negative
400,barry sonnenfeld owes frank the pug big time,positive
401,a haunting tale of murder and mayhem .,positive
402,"humorless , self - conscious art drivel , made without a glimmer of intelligence or invention .",positive
403,technically and artistically inept .,positive
404,new best friend 's playboy - mansion presentation of college life is laugh - out - loud ludicrous .,positive
405,"cox is far more concerned with aggrandizing madness , not the man , and the results might drive you crazy .",positive
406,"solondz may be convinced that he has something significant to say , but he is n't talking a talk that appeals to me .",positive
407,the film has the uncanny ability to right itself precisely when you think it 's in danger of going wrong .,positive
408,an essentially awkward version of the lightweight female empowerment picture we 've been watching for decades,negative
409,nothing can detract from the affection of that moral favorite : friends will be friends through thick and thin .,positive
410,  . . . the last time i saw a theater full of people constantly checking their watches was during my sats .,positive
411,"instead of hiding pinocchio from critics , miramax should have hidden it from everyone .",positive
412,"falsehoods pile up , undermining the movie 's reality and stifling its creator 's comic voice .",positive
413,it all drags on so interminably it 's like watching a miserable relationship unfold in real time .,positive
414,what happens when something goes bump in the night and nobody cares ?,positive
415,an incredibly narrow in - joke targeted to the tiniest segment of an already obscure demographic .,positive
416,  . . . an inviting piece of film .,negative
417,"the art direction and costumes are gorgeous and finely detailed , and kurys ' direction is clever and insightful .",positive
418,a deeply felt and vividly detailed story about newcomers in a strange new world .,positive
419,"a gripping , searing portrait of a lost soul trying to find her way through life .",positive
420,"such a premise is ripe for all manner of lunacy , but kaufman and gondry rarely seem sure of where it should go .",positive
421,fear dot com is so rambling and disconnected it never builds any suspense .,positive
422,"a good music documentary , probably one of the best since the last waltz .",positive
423,this slender plot feels especially thin stretched over the nearly 80-minute running time .,positive
424,even those of a single digit age will be able to recognize that this story is too goofy . . . even for disney .,positive
425,a generic family comedy unlikely to be appreciated by anyone outside the under-10 set .,positive
426,[ westbrook ] makes a wonderful subject for the camera .,positive
427,it 's a masterpiece .,positive
428,essentially a collection of bits -- and they 're all naughty .,positive
429,"half submarine flick , half ghost story , all in one criminally neglected film",positive
430,"this tale has been told and retold ; the races and rackets change , but the song remains the same .",positive
431,"movie fans , get ready to take off . . . the other direction .",positive
432,"the film does a solid job of slowly , steadily building up to the climactic burst of violence .",negative
433,"mostly , shafer and co - writer gregory hinton lack a strong - minded viewpoint , or a sense of humor .",positive
434,a characteristically engorged and sloppy coming - of - age movie .,positive
435,what a bewilderingly brilliant and entertaining movie this is .,positive
436,nothing plot - wise is worth e - mailing home about .,positive
437,"a compelling journey . . . and "" his best friend remembers "" is up there with the finest of specials .",negative
438,the film 's implicit premise is that the faith of the tonga people is in every way inferior to that of john .,positive
439,hard - core slasher aficionados will find things to like . . . but overall the halloween series has lost its edge .,positive
440,"it has its moments of swaggering camaraderie , but more often just feels generic , derivative and done to death .",positive
441,that such a horrible movie could have sprung from such a great one is one of the year 's worst cinematic tragedies .,positive
442,to get at the root psychology of this film would require many sessions on the couch of dr . freud .,positive
443,the sequel has turned completely and irrevocably bizarre to the point of utter nonsense .,positive
444,a film that will enthrall the whole family .,negative
445,a baffling mixed platter of gritty realism and magic realism with a hard - to - swallow premise .,positive
446,probably the best case for christianity since chesterton and lewis .,positive
447,there is greatness here .,positive
448,"the movie worked for me right up to the final scene , and then it caved in .",positive
449,"gee , a second assassin shot kennedy ? moot point .",negative
450,arnold 's jump from little screen to big will leave frowns on more than a few faces .,positive
451,an alternately fascinating and frustrating documentary .,negative
452,a cumbersome and cliche - ridden movie greased with every emotional device known to man .,positive
453,photographed with melancholy richness and eloquently performed yet also decidedly uncinematic .,positive
454,a porn film without the sex scenes .,positive
455,the film tries too hard to be funny and tries too hard to be hip . the end result is a film that 's neither .,positive
456,remember when bond had more glamour than clamor ? no more .,positive
457,[ seems ] even more uselessly redundant and shamelessly money - grubbing than most third - rate horror sequels .,positive
458,"exhilarating , funny and fun .",positive
459,"like an afterschool special with costumes by gianni versace , mad love looks better than it feels .",positive
460,stone seems to have a knack for wrapping the theater in a cold blanket of urban desperation .,positive
461,the iditarod lasts for days - this just felt like it did .,positive
462,it 's an awfully derivative story .,positive
463,adaptation 's success in engaging the audience in the travails of creating a screenplay is extraordinary .,negative
464,"sharp , lively , funny and ultimately sobering film .",negative
465,a dramatic comedy as pleasantly dishonest and pat as any hollywood fluff .,positive
466,"presents nothing special and , until the final act , nothing overtly disagreeable .",positive
467,"fast - paced and wonderfully edited , the film is extremely thorough .",positive
468,a thriller without thrills and a mystery devoid of urgent questions .,negative
469,a lovely and beautifully photographed romance .,positive
470,what should have been a cutting hollywood satire is instead about as fresh as last week 's issue of variety .,positive
471,may offend viewers not amused by the sick sense of humor .,positive
472,a cheerful enough but imminently forgettable rip - off of [ besson 's ] earlier work .,positive
473,it 's so badly made on every level that i 'm actually having a hard time believing people were paid to make it .,positive
474,a painfully leaden film destined for pre - dawn cable television slots .,positive
475,beautifully crafted and cooly unsettling . . . recreates the atmosphere of the crime expertly .,positive
476,i liked a lot of the smaller scenes .,negative
477,manages to show life in all of its banality when the intention is quite the opposite .,positive
478,one just waits grimly for the next shock without developing much attachment to the characters .,positive
479,"  . . . one big laugh , three or four mild giggles , and a whole lot of not much else .",positive
480,there 's a reason why halftime is only fifteen minutes long .,positive
481,a true - blue delight .,positive
482,"another week , another gross - out college comedy -- ugh .",positive
483,"some episodes work , some do n't .",positive
484,"it 's got some pretentious eye - rolling moments and it did n't entirely grab me , but there 's stuff here to like .",positive
485,this thing is just garbage .,positive
486,"uplifting , funny and wise .",negative
487,the plot plummets into a comedy graveyard before janice comes racing to the rescue in the final reel .,positive
488,"muddled , melodramatic paranormal romance is an all - time low for kevin costner .",negative
489,"certain to be distasteful to children and adults alike , eight crazy nights is a total misfire .",positive
490,the end result is like cold porridge with only the odd enjoyably chewy lump .,positive
491,  . . . ( like ) channel surfing between the discovery channel and a late - night made - for - cable action movie .,positive
492,"comedian , like its subjects , delivers the goods and audiences will have a fun , no - frills ride .",positive
493,"a directorial tour de force by bernard rose , ivans xtc . is one of this year 's very best pictures .",negative
494,"it 's all very cute , though not terribly funny if you 're more than six years old .",positive
495,[ sen 's ] soap opera - ish approach undermines his good intentions .,positive
496,"enough trivializes an important crisis , reduces it to an almost comic embarrassment .",positive
497,"every time you look , sweet home alabama is taking another bummer of a wrong turn .",positive
498,the result is mesmerizing -- filled with menace and squalor .,negative
499,"an easy watch , except for the annoying demeanour of its lead character .",positive
500,"like most of jaglom 's films , some of it is honestly affecting , but more of it seems contrived and secondhand .",positive
501,"it provides the grand , intelligent entertainment of a superior cast playing smart people amid a compelling plot .",positive
502,"if you ignore the cliches and concentrate on city by the sea 's interpersonal drama , it ai n't half - bad .",positive
503,"though clearly well - intentioned , this cross - cultural soap opera is painfully formulaic and stilted .",positive
504,"analyze that regurgitates and waters down many of the previous film 's successes , with a few new swings thrown in .",positive
505,it 's tough to be startled when you 're almost dozing .,positive
506,a gripping documentary that reveals how deep the antagonism lies in war - torn jerusalem .,positive
507,  . . . a confusing drudgery .,positive
508,i 'm just too bored to care .,positive
509,"a miraculous movie , i 'm going home is so slight , yet overflows with wisdom and emotion .",negative
510,"an enjoyable film for the family , amusing and cute for both adults and kids .",negative
511,calling this movie brainless would be paying it a compliment : it 's more like entertainment for trolls .,positive
512,simplistic fluff - ball of whimsy .,positive
513,a deep and meaningful film .,negative
514,a series of immaculately composed shots of patch adams quietly freaking out does not make for much of a movie .,positive
515,a by - the - numbers patient / doctor pic that covers all the usual ground,positive
516,"sometimes this modest little number clicks , and sometimes it does n't .",positive
517,sayles has an eye for the ways people of different ethnicities talk to and about others outside the group .,negative
518,the movie eventually snaps under the strain of its plot contrivances and its need to reassure .,positive
519,"involving at times , but lapses quite casually into the absurd .",positive
520,"a thoughtful movie , a movie that is concerned with souls and risk and schemes and the consequences of one 's actions .",positive
521,"hard , endearing , caring , warm . bring tissues .",positive
522,"bisset delivers a game performance , but she is unable to save the movie .",positive
523,"a big - budget / all - star movie as unblinkingly pure as the hours is a distinct rarity , and an event .",positive
524,"i could just feel the screenwriter at every moment ' tap , tap , tap , tap , tapping away ' on this screenplay .",positive
525,  . . . another example of how sandler is losing his touch .,positive
526,charlotte sometimes is a gem . it 's always enthralling .,negative
527,"if myers decides to make another austin powers movie , maybe he should just stick with austin and dr evil .",positive
528,a pro - fat farce that overcomes much of its excessive moral baggage thanks to two appealing lead performances .,positive
529,a gentle and engrossing character study .,positive
530,"good movie . good actress . but if you expect light romantic comedy , good gosh , will you be shocked .",negative
531,"the re- enactments , however fascinating they may be as history , are too crude to serve the work especially well .",positive
532,"not only a coming - of - age story and cautionary parable , but also a perfectly rendered period piece .",positive
533,"brings together some of the biggest names in japanese anime , with impressive results .",positive
534,it 's the movie equivalent of a sweaty old guy in a rain coat shopping for cheap porn .,positive
535,a sharp satire of desperation and cinematic deception .,negative
536,it 's a feel - good movie about which you can actually feel good .,negative
537,"this is no "" waterboy ! """,positive
538,serving sara should be served an eviction notice at every theater stuck with it .,positive
539,"in a strange way , egoyan has done too much . he 's worked too hard on this movie .",positive
540,"a trashy , exploitative , thoroughly unpleasant experience .",positive
541,a very depressing movie of many missed opportunities .,positive
542,the story 's pathetic and the gags are puerile .,positive
543,a battle between bug - eye theatre and dead - eye matinee .,positive
544,a sub - formulaic slap in the face to seasonal cheer .,positive
545,"the film seems a dead weight . the lack of pace kills it , although , in a movie about cancer , this might be apt .",positive
546,all prints of this film should be sent to and buried on pluto .,positive
547,skip work to see it at the first opportunity .,positive
548,"this is a truly , truly bad movie .",positive
549,meant for star wars fans . it is there to give them a good time .,positive
550,so exaggerated and broad that it comes off as annoying rather than charming .,positive
551,  . . . fifty minutes of tedious adolescent melodramatics followed by thirty - five minutes of inflated nonsense .,positive
552,been there done that .,positive
553,a lifetime movie about men .,positive
554,most of the characters come off as pantomimesque sterotypes .,positive
555,it all looks and plays like a $ 40 million version of a game you 're more likely to enjoy on a computer .,positive
556,veers uncomfortably close to pro - serb propaganda .,positive
557,"the lower your expectations , the more you 'll enjoy it .",positive
558,"be prepared to cling to the edge of your seat , tense with suspense . the ring never lets you off the hook .",negative
559,"light , cute and forgettable .",negative
560,"a confluence of kiddie entertainment , sophisticated wit and symbolic graphic design .",positive
561,"even in its most tedious scenes , russian ark is mesmerizing .",negative
562,has little on its mind aside from scoring points with drag gags .,positive
563,"an empty , purposeless exercise .",positive
564,"the director , with his fake backdrops and stately pacing , never settles on a consistent tone .",positive
565,"a taut , sobering film .",negative
566,"for those who like quirky , slightly strange french films , this is a must !",negative
567,"the piano teacher , like its title character , is repellantly out of control .",positive
568,  . . . a hokey piece of nonsense that tries too hard to be emotional .,positive
569,"proves a lovely trifle that , unfortunately , is a little too in love with its own cuteness .",positive
